id,text,stress_level,source_type,source_name,source_url,source_record_id,original_label,label_mapping_rule,language,date_collected,collector,labeler,review_status,notes
scraped_00211,"Is HR protecting a bully and what should I do about it?. I am working in a small company. I met a man there and we started a relationship. We worked in the same position but in different teams. The relationship started smoothly but after three months he began to criticize me about work. Example: Your assignment is useless. You and your boss should stop doing that project. You cannot manage your time and workload. You don't know, that's the right answer. (When he asked me to explain about the research I was doing. He repeatedly asked the same question until I snapped saying that I don't know and it's still an assumption.) New assignment? Let her(me) do it. She likes hard work. They (my bosses) are taking advantage of you. And the most painful that causes me a C-PTSD; Try harder. But you will fail. There were other comments but they weren't work-related. I hardly said anything back simply because I thought fighting was troublesome. I just ignored his comments, except sometimes I told him that a job was a job. I am hard-working and I am proud of my working ability. No one, including, my bosses ever criticize my work. I felt very depressed. When I was fed up, I told him he shouldn't say those things to me, personal matters or work-related. He said he was just kidding and no one would get angry over these comments. He said I was too serious and too sensitive, too childish. He said I had no experience of a real world. Of course, we broke up. But I was forced to believe that everything about being nice was wrong. That I had to endure bitter comments to be a grown-up. He never apologised and blamed me for not dropping my attitude. I sought help from a HR manager. I told her the situation. She promised she would warn my ex but there was no punishment or anything. He still sat beside me, talked to me as if there was nothing happen except that he kept his comments to himself. I had flashbacks and panic attacks at work but I endured. I just went for a walk if I couldn't sit there. I eventually sought professional help. When I asked the HR manager if I could tell my boss (about taking a break and going to hospital), she said she would tell my boss for me. But she never did. I am confused. I'm sure what I experienced is workplace bullying. Or was it just my personal issue. Did the HR person stop me from reporting the incidents? I knew she didn't want to lose an employee. But what should we do in this kind of situation, then? Would it be not so professional, if I just reported it to my boss. Edit: I just want to update. Thanks everyone who suggested talking with the HR again. I talked to her that I'd tell my boss about the leave and work schedule. This time, I was surprised that she said I could tell him my situation. So I talked to my boss. He's heard about the impolite remarks for sometimes. The managers are dealing with it. He didn't know that I had been targeted too. He told me I should report to him sooner because those comments weren't good things to throw around the office. Every team and every project is eqaully important. If someone else has any complaint about any project, tell them to talk directly to the managers. He apologised and said it's ok to take sick leave to go to the hospital. He didn't notice that my performance had dropped due to stress. And we discussed how I could work with no contact with my ex. I said I could handle work-related conversation. Finally he thanked me for not leaving. I was lucky that my boss understood. My problem was gone now although I still have to go to the therapy. Maybe talking isn't an option for the other companies. It works for mine. If you encountered the same problem and you wanted to talk, please take many advices below that you need to do it calmly.",Medium,online_scraping_api,Stack Exchange API,https://workplace.stackexchange.com/questions/71757/is-hr-protecting-a-bully-and-what-should-i-do-about-it,71757,workplace:stress workload manage,keyword_query_mapping_v1,English,2026-04-27,project_team,keyword_mapping_needs_manual_review,needs_review,Scraped online text; verify label manually before final modeling.
scraped_00212,"Honours project: should I propose something of my interest, or pick from what offered by supervisors?. I'm from Australia I'm about to start my honours in Computer Science. I aim to do PhD afterwards. My uni does not currently work on the research topic that I'm specifically interested in. Fortunately it allow us to propose our own project ideas. But past students pointed that supervisors can be very perfunctory if I do not work on their projects. They tend to think that you are fully responsible to what you propose and provide minimal help. This makes me concerned. I'm totally new to research, I don't yet know my idea is really doable. If I'm on my own I might screwed up. Should I follow my interest, propose my own topic, and aim for PhD in other universities? Or should I put my interest aside, stick with what's being offered in my uni, so that I can at least get high grades and secure a PhD spot in my current uni? (But will it still be possible to apply for PhD in my dream topic?) BTW I found that topic seems to be popular in Melbourne: RMIT, Deakin and SIT all focus in this area. Is it a good idea to email these universities to express my interest and ask him for what topic I should do to gain PhD spot in their labs? (But I imagine they have their own students to care about and won't be interested in me.) BWT I talked to an old professor who worked in the topic of my interest. He has good attitude and will to supervise me. But whatever I say he just nod and respond 'Good, go for it'. I don't know how helpful he will be.... There's also a younger supervisor who is known to be pushy and responsible. But only supervise his own projects.",Medium,online_scraping_api,Stack Exchange API,https://academia.stackexchange.com/questions/172774/honours-project-should-i-propose-something-of-my-interest-or-pick-from-what-of,172774,academia:concerned about grades,keyword_query_mapping_v1,English,2026-04-27,project_team,keyword_mapping_needs_manual_review,needs_review,Scraped online text; verify label manually before final modeling.
scraped_00213,"Boss is overloading me with work because I want to resign. I started as an intern at a family-owned company. After a year working for them, my supervisor's brother and I started dating. My boyfriend, his brother and their parents all live in the same house. Lately, I have been feeling unmotivated at work and would like to find another job. My current job pays less than half the market salary (I do not have a contract), which prevents me from helping my financially-troubled parents as much as I wish. In addition, my supervisor is not consistent and can be pretty mean. He recently found out about my plans to resign and all a sudden he is trying to get me to do more than I can manage. He added an additional project to my workload and is trying to make sure all the knowledge I have acquired is documented. I originally wanted to leave at the end of the year, but due to the increased stress, I'm am considering leaving much sooner. How do I maintain the situation until year-end? I'm not sure if stick it out that long.",Medium,online_scraping_api,Stack Exchange API,https://workplace.stackexchange.com/questions/56590/boss-is-overloading-me-with-work-because-i-want-to-resign,56590,workplace:stress workload manage,keyword_query_mapping_v1,English,2026-04-27,project_team,keyword_mapping_needs_manual_review,needs_review,Scraped online text; verify label manually before final modeling.
scraped_00214,"Contacting the employer again after a long pause. On the first day of summer 2023, I defended my PhD and soon took a very long vacation to have a good rest, and went to my hometown. While on vacation, I unexpectedly came across an interesting vacancy. I was attracted to it because it was a good starting position for working in a new area of scientific interest. I responded, but didn’t expect to receive an invitation. Everything turned out differently. The head of one of the departments contacted me, we phoned, I told about myself, he briefly told me what his department was working on and sent me introductory materials. He said that after that there would be more interviews with him and his colleagues, and then with the company’s management. We did not discuss the exact timing of the next contact, but we agreed in the spirit of “when you study the introductory materials”. Well, I read them quite quickly, but I never got in touch... It was August 2023. The fact is that the company is located in a large city and quite far from where I lived and worked recently. But I overestimated my current capabilities and at that moment I was simply not mentally, physically and financially ready for such major changes as moving. Recently, a colleague and I completed a small project, and I felt that most likely it was time to carefully return to full-time work. A little later, I came up with the idea of offering the employer a hybrid work format. That is, visit the company office from time to time, and work remotely the rest of the time. This transitional method would help me both start work and improve my financial situation, which I would later take advantage of and move fully. But about 5 months have passed... Is the path closed or can the situation be somehow improved and trust restored?",Low,online_scraping_api,Stack Exchange API,https://workplace.stackexchange.com/questions/194887/contacting-the-employer-again-after-a-long-pause,194887,workplace:good time management,keyword_query_mapping_v1,English,2026-04-27,project_team,keyword_mapping_needs_manual_review,needs_review,Scraped online text; verify label manually before final modeling.
scraped_00215,"A peculiar PhD situation, working full time in a government lab but getting my PhD from an unknown university because of formalities. Advice?. I am involved in a peculiar PhD situation. I am working full time at a government lab that is fairly new ( During the past four years, I have been very productive and managed to create a solid publication record at A-level and A*-level conferences and journals, as well as a decent citation count (~150). I am first author in most of my papers, and some of the people I worked and published with are very established and acclaimed academics in this field. Before starting my PhD, a obtained an Electrical Engineering degree and a Masters degree from top schools in worldwide rankings. Now my question is, do I need to somehow reflect this situation in the form of a justification of why I am getting my PhD from an unknown university? Or the fact that after two excellent school names, I have this third name in my CV that is unknown and overall a weird addition?",Low,online_scraping_api,Stack Exchange API,https://academia.stackexchange.com/questions/102785/a-peculiar-phd-situation-working-full-time-in-a-government-lab-but-getting-my-p,102785,academia:good time management,keyword_query_mapping_v1,English,2026-04-27,project_team,keyword_mapping_needs_manual_review,needs_review,Scraped online text; verify label manually before final modeling.
scraped_00216,"On how to handle frustration and an advisor who does not put effort in my success. I am a ""freelance"" (not yet enrolled as a student) research assistant in lab at a top-20 university in Japan doing computer engineering related research. I am planning to obtain a PhD in this field, potentially in this lab. Despite my position, I am not bound to any particular project and I am focusing my current research into laying the groundwork for my PhD course. However, despite my motivation, our research fields aligning, and her explicit support towards me pursuing a PhD degree with her, I feel my current PI/future advisor is not interested in my research nor my future. Several signs that make me feel this way are: Lack of engagement: My PI needs to be reminded on a weekly basis about what my research is about and she does not offer research guidance even when directly asked to do so. We have discussed research avenues but her suggestions were either flaky, dismissive, or not helpful. Inaction and/or tardiness: She does not reply to emails in a timely manner, even after several, reasonably well-spaced reminders. Furthermore, she also ignored my request to review a research plan for the admission committee. Consequently, the deadline to present the research plan expired, although I managed to submit it in time. Lack of or poor resource management: My PI allocates limited resources into my research. The laboratory is objectively well funded. As a consequence of this, my research has stalled significantly, and I feel like I am stuck and not making good use of my time. I personally frame this behaviour in the fact that I am not actually a full student, so she is limiting the amount of effort she is putting into my research as a whole. However, I believe it is in everyone's best interest to have me perform well at this stage. We also talked about the possibility of having her write a letter of recommendation to other professors in similar laboratories in case the admission committee does not move forward with my application, but this has not borne fruit either. I have found similar questions in this substack, namely: I feel like my research is stalled because of a lack of available mentors and my lab situation isn't conducive to research. What are my options? How do I stay motivated in my PhD research when my advisor doesn't seem to like me very much? Why my PhD supervisors do not want to be involved in my research ideas? but none of them tackle my issue. I thought about having a private conversation with her about this issue, but I fear it might come off as pretentious or in poor taste. I have started to look for opportunities elsewhere, but I do not know how to introduce this to her or whether it is feasible to ask her for letters of recommendation for these opportunities. Considering the circumstances, am I entitled to feel frustration? What can I do to mitigate this?",Low,online_scraping_api,Stack Exchange API,https://academia.stackexchange.com/questions/224201/on-how-to-handle-frustration-and-an-advisor-who-does-not-put-effort-in-my-succes,224201,academia:good time management,keyword_query_mapping_v1,English,2026-04-27,project_team,keyword_mapping_needs_manual_review,needs_review,Scraped online text; verify label manually before final modeling.
scraped_00217,"Dealing with double standards from my wife. My wife and I have known each other and been good friends for around ten years, but only got together four years ago. Fast forward to today we are married, have our own place and a 2.5 year old son. We only recently married, but our relationship has been solid for the most part with a few hurdles here and there which seem natural enough, but I've noted a couple of times that I'm being held at a different standard that she isn't holding herself to. We've had this discussion about a number of topics like work, children responsibilities, free time management to name a few. However since I'm only focusing on a few cases regarding the opposite sex and we've had few enough instances where that's been an issue so I'll preface those. The first time was when we've been together for around a year, we were living together and she was pregnant. She asked me to fix something on her laptop as I'm tech-savvy unlike her. Due to her broken touch pad (sometimes it went crazy for a second or two) I miss-clicked and found myself in a folder which contained pictures send by Viber which I didn't know she had and that seemed a bit sketchy, but what really got my attention was a picture of her ex carrying her bridal style in front of a bed you'd assume right before intercourse. Now I won't say I felt good seeing the picture, but being an adult I understand that she's had previous relationships and so have i, and then I saw that the picture was sent 3 days before we got together which made me feel uneasy. I should mention that my previous relationship which lasted more than three years ended pretty badly with me finding out she had cheated multiple times, had at least two relationships ongoing relationships while she was with me and it left me with trust issues, something I had discussed at length with my now wife. So at this point my reaction was to check her messenger, something I hadn't done until that point since I never felt I had a reason to, but I was having a "" Oh no, not again "" moment and I found out they were still talking frequently in a very friendly matter, which seemed odd considering she told me he abused/beat her and that if I ever lay a hand on her she will immediately leave me. During their conversations I noticed that he often talked about sex, not with her per se, but she didn't seem to mind it either way. My next reaction wasn't very adult-like, but I just left the laptop as it was - showing that I had read the conversations and seen the picture, went to a friend's place and had a couple of beers while not picking up my phone. The reason I did this however was because I knew I was affected and probably angry so I had to clear my head before talking about it. I didn't mention a thing to my friend, but was thinking about it the whole time and tried not to jump to conclusions, before she had the opportunity to explain so after feeling I had cooled down went home to talk. She explained that she doesn't use Viber anymore, that's why I didn't know about it and she can't control when someone sends something and asked if she wanted to stop talking to her ex - to which I replied yes, though looking back at it I probably shouldn't have asked. She told him that they can't talk anymore emphasizing on the part that I don't want them to and that kind of hurt me, not because it wasn't true, but the way it was said and the response was him insulting me for being a ""pussy"" to which she only sent smiley emojis. In the end we agreed that I overreacted, moved on and this hasn't come up ever since. She also removed all of her password-saving on our laptops so I cannot access anything on my own. I won't go into this much detail with the times she has confronted me with those kind of issues, but in my eyes they were ridiculous at best. Being friendly over messenger with my female cousin who I've spend my childhood with (she didn't know we were cousins) Playing an online game with a group of people, one of which happens to be a girl (it's a 5 vs 5 game), which I've never met, and we were planning a meeting since we (me, wife and child) were going to be visiting their (the four other people, girl involved) town and wanted to do a real-life meetup since we were playing quite often at that point. I essentially had to cut all ties with those people, which subsequently killed my desire to play the game at all. Getting hints (which I'll admit I totally missed) by a girl online, to which I didn't reciprocate anyway as she was helping me with a part-time work assignment and that was entirely where my conversations with her were aimed at. This is from the current year so it shows that she is still digging through my messages, but I don't mind it all that much if she feels more secure, it's still a bit insulting that she doesn't trust me though. Recently got a new job in a small firm and although she seemed uninterested by my new office/male colleagues she had a mild reaction when she found out that I had a female colleague as in she asked a bunch of questions like ""is she good looking"" ""how old"" etc.. Meanwhile in the last couple of months at her work she is constantly asked to travel with her boss/supervisor who is the one who got her the job there. He has been nothing, but good to us, getting her that job which is extremely niche and has only several positions in the entire country, not to mention it's been her dream job for as long as in know her. I have only good feelings regarding this person and feel grateful for the opportunity he has provided her. As of late she has needed to travel quite frequently for the conferences from work as well as, because she is working to get her master's degree and the speciality she needs is not available in our city. I don't mind the traveling in itself, but she tags her boss with her even when it's not entirely necessary e.g few days ago she went for her thesis defense and he joined in because she needs moral support/help to prepare. I want to emphasize that this is not about trust. I don't suspect that she is cheating, but I'm somewhat annoyed because knowing her if I brought it to light as something that's bothering me she would probably ridicule me as she always does when I so much as hint I might be jealous, even though I imagine if the tables were turned she would most likely go batshit crazy. So my question is how can I get my wife to see that she is holding me to a higher standard than she holds herself?",Low,online_scraping_api,Stack Exchange API,https://interpersonal.stackexchange.com/questions/18852/dealing-with-double-standards-from-my-wife,18852,interpersonal:good time management,keyword_query_mapping_v1,English,2026-04-27,project_team,keyword_mapping_needs_manual_review,needs_review,Scraped online text; verify label manually before final modeling.
scraped_00218,"Dealing with manager that has high turnover but great reviews from departing engineers. I've been tasked with finding a way to work with a very unique manager in my division. He's an especially gifted individual (i.e. can learn a new programming language or tech stack over the weekend, and can be an expert in it within a month). He was promoted from principal engineer to manager (we're a fairly large company, think ""XYZ 500"" company) before his supervisor resigned. I personally wouldn't have promoted him to manager, but he's a manager regardless and is often on the critical path (i.e. involved in important projects). Let's call this manager ""Bradley"". Bradley has a recurring habit of developing very capable teams under him, and using almost all of his team budget for buying training programs and certifications for people on his team. He seems to build up a great team, but most people on the team resign within about 18 months of joining, yet they leave beaming reviews about him being a great manager on their way out the door . My superiors are frustrated with the amount of money going into training people that just leave the company with the new skills and certifications they earn, but we can't exactly discipline or fire Bradley if everyone leaving the company gives him an overwhelmingly positive review. Bradley apparently also writes detailed letters of reference and signs off on P.Eng./RPE papers for people as they're leaving , so he seems happy to help his subordinates get jobs elsewhere, after burning through training and lunch/fun-funds. All people leaving his team, during exit interviews, seem to be using some kind of script where they praise him, and cite salary and incompetence by Bradley's boss's boss as their reason for leaving. This has happened 8 times. It feels very much staged. About a month back, a fellow senior manager tried stop this pattern by encouraging Bradley to do more remote lunchtime-meet-and-greets with his team (so Bradley's budgets are spent on something other than training team members), and Bradley told the manager, in clear terms, ""F*** off! That's a waste of time, and the whole team knows it. My job is to have this team excel and make a ****-load of $$ for the company, and to develop my subordinates so they can make more $$ and develop their own careers and CVs, end of ****ing story."". This did not go over well with my colleague or HR. While Bradley is a ""net plus"" for our organization, he seems to be angering enough of the higher-ups that we may have to let him go due to his negative impact on the morale of management. Is there any way to get this guy to smarten up? I feel he could do a lot of good if he got on-board with the existing company culture.",Low,online_scraping_api,Stack Exchange API,https://workplace.stackexchange.com/questions/186705/dealing-with-manager-that-has-high-turnover-but-great-reviews-from-departing-eng,186705,workplace:good time management,keyword_query_mapping_v1,English,2026-04-27,project_team,keyword_mapping_needs_manual_review,needs_review,Scraped online text; verify label manually before final modeling.
