id,text,stress_level,source_type,source_name,source_url,source_record_id,original_label,label_mapping_rule,language,date_collected,collector,labeler,review_status,notes
scraped_00138,"How to preserve professionalism in a difficult environment. I work as software engineer in a pretty young company (5 years old) and I'm making a lot of errors that can ruin my career. Until some months ago everything was great: the compensation is just ok. We had almost always enough time to do things the right way and I felt I would have great career opportunities (like new important large-scale projects to lead). I always had exceptional feedback from my manager and the other company departments I worked with, about the software I wrote or managed. About 8 months ago a new project arrived, this was a ""career changing project"", a large scale application that would open the company to a new market, potentially generating lots of revenues. Since I was striving for career advancements and I always had great feedback, I ended up to leading the development of this new project. I was prepared for the pressure, from my manager and from the executives, but then real problems started to arise. Starting from a technical point of view, I wasn't able to take any significant choice. In order to ""develop things faster"" I was forced to use an already written software made from another software department of another company (part of the same holding). Initially I was ok with that, because on the paper it sounds good, until I noticed big problems in the software structure (this software wasn't really used anywhere before) and a data model and business logic that were completely different from what I need to do. On top of that, we started work on this software before the requirements were really defined, because an unrealistic deadline was set, before doing any analysis before. The process in the company has been more or less like this: someone important decided that we will launch this new product on date X, whatever it takes I was forced to start working on this stuff before any defined requirement the ""business people"" produced some requirements and kept changing them until 1 month before launch I and my team worked about 11/12h per day, for about 6 months, with Saturday included for 1/2 months, in order to release the project. I personally also worked more, after leaving the office. In these months I raised my concerns to the management but the reply was always the same: ""the project must be finished on time, no matter what"". I also tried to expose the risks of doing that (bugs, data loss here and there...) but I was forced to stay silent. Somehow, we managed to launch the product on time but with big sacrifices: no proper software testing was done, the code is pretty much unmaintainable and bugs are not rare. I feel that I have completely lost my credibility with this project; I feel guilt when I look at my code. Some really bad bugs arose, things like creating some duplicate invoices or charging some users more than one time, in particular circumstances (bugs I caused personally, with my code). I would say that the software is doing a lot better than what I expected but these are still very bad problems. I'm losing my face as a professional, because I'm responsible for this project, in particular for the invoice/payments part that I wrote personally and we've lot of problems. I feel that people in the company start feeling that I'm not a really good professional like they thought. I was promised a promotion by doing this project, but I fear that these mistakes could cancel that. I'm also not able to focus clearly anymore, I'm tired, I feel I'm not able anymore to do things well, like I used to. On top of that, every problem now is an emergency and I never have the time to do things in the right way. I feel like I'm in ""zombie mode"". Even if I started to leave the office earlier, I feel that the stress due to this project made me dumb. What can I do for avoid losing my professionalism? How can I recover my ""reputation"" as a professional? Is it possible in the same company? What can I do better, now? My big takeaway from this experience is: never subordinate totally the quality of your work to the deadlines, because when problems arise no one remembers the sacrifices; all they see is that you made a bad job . 2023/06/07 - Update: Several days passed and that's how it's ended: I got promoted to a manager, now I lead a team on this project. I'm not working overtime anymore and I ensure no one of the team does. We started to track all our activities (bugs and features) so that project management is updated on what we're doing. I make estimations on development time with the team and we're very careful to not underestimate the efforts. So far we haven't missed any deadline. Sill, there are critical bugs and lot of pressure on new developments, but I managed to don't worry too much about that, we're doing our best and solving all the problems step by step. We're also managing to improve some code here and there, to improve software quality. I'm a professional and my job is to make things work well and develop maintainable quality software. I can't do shit just because the CEO wants something real quick and nobody wants to say no (you'll pay that later). This is how we're working now and I'm feeling that pays off. I feel also that I'm doing a good job, we're accomplishing a lot of improvements. We'll see with time if I can continue to work like this or it's just a less cahotic period. Can we consider this an happy ending? A huge thank you to everyone which replied/commented my post.",Low,online_scraping_api,Stack Exchange API,https://workplace.stackexchange.com/questions/191534/how-to-preserve-professionalism-in-a-difficult-environment,191534,workplace:good time management,keyword_query_mapping_v1,English,2026-04-27,project_team,keyword_mapping_needs_manual_review,needs_review,Scraped online text; verify label manually before final modeling.
scraped_00139,"Seeking insight on work environment. I recently joined a healthcare institution of about 5000 employees as an Information Security Officer (my boss being CIO) and have encountered several situations that have led me to question the workplace culture and management practices. I have no direct line to the CEO or board, and the CIO and CEO are best friends. All coms to the board need to go through the CIO. I'm hoping to gain some perspective on whether these are typical challenges or an indication of a deeper, more systemic issue. Since my first day, the low morale among team members was evident, with remarks like ""good luck with your job, you're going to need it."" There seems to be a disconnect between the organization's claims of valuing transparency and the actual communication practices observed. The IT department has experienced significant turnover, with the interim head, a former school friend of the CEO, having been made permanent. This has led to mixed reactions within the team. My role is pivotal for steering the organisation towards compliance with new regulations (ISO27K, NIS2). However, there's a persistent push from leadership to prioritise operational tasks over strategic compliance efforts, undermining the effectiveness of our security posture. For example, asset management is not seen as a priority and will only be picked up in 8 months from now, way to late for achieving our compliance target. Despite the size of our organization (5,000 employees), support for our security and compliance efforts is minimal. After highlighting the need for more manpower, the solution was to allocate only two existing employees part-time, which is vastly insufficient for my line of work. Weekly management meetings are inefficient, often extending well beyond their scheduled time with little progress. Discussions tend to get derailed by minor technical details, preventing strategic issues from being adequately addressed. A recent project highlighted severe communication breakdowns between the application and infrastructure teams. My suggestion to implement an Architecture Review Board (ARB) was dismissed in favor of less formal communications, which I believe hampers project management effectiveness. In a meeting attended by 20 staff members, our interim manager discussed his own contract issues openly, revealing he worked without a contract for three months due to its high value, which required additional procurement controls. This discussion was both inappropriate for the setting and indicative of a culture that may overly focus on monetary values at the expense of professional integrity. There was a troubling incident where it became known that management was considering firing a service desk manager by setting him up to fail. This was to be achieved by assigning him impossible tasks and, during a restructuring, subtly redefining his role to force him to reapply, potentially disqualifying him under new criteria. I'm worried that scrutiny of failing to comply to the regulations might result in me getting fired. Given these points, I am increasingly concerned about the potential toxicity of this work environment. I would greatly appreciate some insights or advice on how to best navigate these issues… Thank you for your help!",Low,online_scraping_api,Stack Exchange API,https://workplace.stackexchange.com/questions/197345/seeking-insight-on-work-environment,197345,workplace:good time management,keyword_query_mapping_v1,English,2026-04-27,project_team,keyword_mapping_needs_manual_review,needs_review,Scraped online text; verify label manually before final modeling.
scraped_00140,"Should I explain my grades in my application to grad school?. First, some general information about me. I am studying in an integrated bachelor's and master's program majoring in biology at a top-20 institute in India. In most aspects, my application (in my opinion) is pretty strong. I have worked in three labs at my home institution working on my own projects (i.e. hypothesis-guided research as opposed to technician-type work), and one of these projects has recently led to a preprint on which I am an author. I have been conducting my master's thesis in the US at an Ivy for the past few months. My recommendation letters will come from all profs that I have directly worked under, and I know that they will be extremely positive. Thus I know that I will handle a research environment really well and am a perfect fit for competitive schools. I will be applying to graduate programs in neuroscience in the US this year, including the program at the same uni where I am currently doing my thesis. The reason for my worry is that I have a very average GPA. Converted to the US 4.0 scale it is 3.2, and 3.4 considering only courses from my major. My GPA has been greatly brought down by a handful of C and D grades in courses not relevant to my research interest, and overall my school has a strict no-inflation policy which has reduced my grades in courses, even those where I performed well. Should I explain my overall low GPA in my SOP or in a separate document in my applications? My main reasons are not due to any particular hardships like health or financial issues, I was just disinterested in the courses after a few months and I spent more time in the lab than on the coursework. Would being honest about my situation as being purely self-inflicted be appreciated by admissions committees? Or should I not explain my transcript and let the rest of the application do the talking? I am mainly concerned about being filtered out at the very start (as some programs anecdotally appear to do) before my application is even read in its entirety and given a fair chance.",Medium,online_scraping_api,Stack Exchange API,https://academia.stackexchange.com/questions/202708/should-i-explain-my-grades-in-my-application-to-grad-school,202708,academia:concerned about grades,keyword_query_mapping_v1,English,2026-04-27,project_team,keyword_mapping_needs_manual_review,needs_review,Scraped online text; verify label manually before final modeling.
scraped_00141,"Clash of working styles with boss. My boss and I have different working styles and I'm out of ideas for how to address this. First, I want to be absolutely clear. On a personal level he and I get along great. We go out for a beer sometimes, and have been at some of the same gigs. I've met his partner and he mine. He's a good guy. Further, much as I might like it to be, this isn't an issue of me the brilliant model employee and my objectively unreasonable boss. This is just a difference in approaches where I don't think either of us are strictly ""right"". However. I find he changes his mind about approaches too often. We will, as a team, agree an approach to an issue. Or minimally, I consider that approach agreed. He, though, changes his mind about how we're doing this and, in the best case, renders some work I have done towards it no longer relevant. In the worst case, in one specific instance, he changed his mind about how to manage an event we were running on the day of the event, leaving no one with any clue what was happening and the event, predictably, a disaster. That's an extreme example though, normally there is more notice than that. Due to our different personal situations, he doesn't mind the occasional late night or weekend work or whatever if a task is nearing a deadline and stuff needs doing. My longer commute and different home life though mean I don't like to do that if it can be avoided. Again, I'm very conscious that I'm phrasing this as if he is solely to blame but that's a function of me writing this not him. I can be inflexible in other areas and its likely I'm being here. It has been noted that I ""close"" conversations unexpectedly quickly in other contexts and it seems reasonable to assume I'm doing so here. However the combination of our two ways of working is not very good and it leaves me very stressed as I never feel like I know whats going on or what I should be doing. I tried, last month, writing up my understanding of the conversation we had had and putting it as a Google Doc that he could edit along with a note saying ""here's what I think is going on. Am I right? You have editing rights to the document so let me know if there's anything I've missed or misunderstood"". He changed a couple of minor points but nothing of substance. Today I learn that we're changing huge swathes of this and I'm gonna end deleting a bunch of files. Its not that this new way is terrible - in truth, it has some advantages - its just that it isn't what I thought we were doing. I've also tried discussing it with him and with his line manager (which is appropriate given our structure, there's no suggestion that this is going over his head or behind his back or anything). He agrees that there is a mismatch here but can't see what to do with it. His line manager essentially said ""oh you know what is like"" and didn't really offer anything constructive. I'm looking for other strategies to try, conversational points to raise, tactics, etc. to try to resolve this situation and would appreciate any suggestions. In response to a request for clarification: The issue is that his working style leaves me feeling I don't know what's going on and what actions I should be taking whereas mine, I sense, leaves him feeling pressured into making decisions before he's ready.",High,online_scraping_api,Stack Exchange API,https://workplace.stackexchange.com/questions/139366/clash-of-working-styles-with-boss,139366,workplace:extreme stress deadline,keyword_query_mapping_v1,English,2026-04-27,project_team,keyword_mapping_needs_manual_review,needs_review,Scraped online text; verify label manually before final modeling.
scraped_00142,"Employee name removed from the organization chart. I recently noticed something weird. I have been working in a company as an R&D researcher since 2019. I have been part-time during my studies as a master's student and then got hired as a full-time employee afterward. I am an engineer and EIT member, but the company assigned a non-engineering title for my position and a junior name. They have not even changed over the years that I have been with them. I recently noticed that my name is not included in the new organization chart. Basically, they removed my name from the organizational chart. My research paper and work got published as a patent in some other competitive company without them taking an action against that. There is a recent management change in the company, and the new management does not even know what I have done or am doing. No one is following those patent things right now. My name is still on the employee page but got removed from the organization chart. This made me sad. Do all those mean that they do not value my work and do not want me to be part of them? I assume it is meaningful when your name has been removed from the organization chart. I recently got a job offer from some other company. Do you think it is a good idea to negotiate with these people to stay? If so, how? Or do I need to move? Please note that: there is no new manager coming from outside; it is just a manager coming from other department and taking over the power. The person has been in the company for the past 10-15 years. They fired my old manager and some other people; that is why I assume those.",Low,online_scraping_api,Stack Exchange API,https://workplace.stackexchange.com/questions/189510/employee-name-removed-from-the-organization-chart,189510,workplace:good time management,keyword_query_mapping_v1,English,2026-04-27,project_team,keyword_mapping_needs_manual_review,needs_review,Scraped online text; verify label manually before final modeling.
scraped_00143,"How does one find and select a PhD program in Computer Science (and/or Mathematics)?. How would I find and select a PhD program in Computer Science, or Computer Science combined with Mathematics? Since I am not a traditional candidate, I am unable to seek relevant advice from professors and fellow student. I am not too concerned about school ranking. Some background about me and my circumstances may help frame the question and better focus the answer. I have substantial experience in software engineering (over 20 years), including analysis, requirements, architecture, design, (extensive) hands-on development, testing, systems, team leadership, mentoring, management, and process. Many colleagues have said that I am really good at explaining concepts. I could continue working in software development. I have a BS Mathematics and Computer Science minor, earned prior to my software career. And I am halfway through a MS Computer Science (part-time). Grades are solid (3.8 undergrad, 4.0 grad), the schools are good, and GRE scores are good enough (>160). I would either return to my career or I would seek a position teaching at the college level. I am not concerned about about tenure or reputation, nor do I expect to become wealthy. I am willing to TA, and would probably enjoy it.",Medium,online_scraping_api,Stack Exchange API,https://academia.stackexchange.com/questions/102813/how-does-one-find-and-select-a-phd-program-in-computer-science-and-or-mathemati,102813,academia:concerned about grades,keyword_query_mapping_v1,English,2026-04-27,project_team,keyword_mapping_needs_manual_review,needs_review,Scraped online text; verify label manually before final modeling.
scraped_00144,"How can I overcome the setbacks of a negligent supervisor after earning a PhD degree?. I'm legitimately looking for advice and to try to take control of my life and my job prospects post-graduation, but also feel that I can't portray the challenge of my situation honestly without recognizing that my supervisor really does carry quite a lot of blame here. If it helps, she is pretty universally recognized as terrible at her job at this point: Everyone I have ever known who has worked with her has had challenges, with several of her former students straight up refusing to work with her ever again, and the chair of my department disclosed to me when I spoke to him about my concerns that she received a zero on her last performance evaluation. Anyway, I am currently nearing the end of my PhD degree (criminology) and am worried about how a poor history of publishing and working with my supervisor will reflect on me when I look for work after completion. In short, I have had a very, very challenging time working with my supervisor, who has been extremely negligent throughout the course of my degree and to an extent that I didn't fully grasp the scope of until it was too late for me to change supervisors. Among other ways in which she's impacted my degree progress, she spent years promising me a data set that she never delivered on (forcing me to completely redesign my study five years into my degree) and waited 18 months on signing paperwork that would see me paid for a policy report I wrote with her, only for that report to never be published. In nearly every meeting I have tried to have with her, she has made clear to me that she is too overworked and/or in too much emotional distress (she is currently going through a nasty divorce) to have time for me right now, and can I please check in with her later. I won't go on - but it's been quite a lot of this, for several years now. My department is aware of these issues with my supervisor, but they haven't been able (or, probably, willing) to do much to help me, beyond assisting me in restructuring my committee. I have managed to restructure my research to the point where completing my degree finally feels like a possibility, although my dissertation is pretty bad. What I am concerned about now is the extent to which my poor experience with my supervisor will impact me while I'm looking for work. I don't have a lot to show for the work I've done with her, as she did not take the necessary steps to see many of our projects through to completion. Combined with the fact that I'll be producing a poor dissertation I don't feel confident publishing, I am worried that this entire experience will give me a fairly worthless PhD degree that I can't sufficiently back up with the skills and experience that I should have earned while in my graduate program. The truth is, though - I do actually feel that I am a very competent researcher and teacher. I have a lot of experience working independently and ""figuring things out on my own"" (grant writing, web design, reference management software, statistics software, etc.) due to her negligence. I just worry about not having the output to back any of my claims to be good at these things up when I'm interviewing. Is it at all acceptable to bring up a bad relationship with a supervisor in a job interview? How much can I expect this to reasonably impact me while job searching, and What are the best ways to compensate for this and sell myself for my abilities? I'm prioritizing work in industry (research and policy-related) over academia, if that changes any answers at all (this experience has burnt me out too much).",Low,online_scraping_api,Stack Exchange API,https://academia.stackexchange.com/questions/177851/how-can-i-overcome-the-setbacks-of-a-negligent-supervisor-after-earning-a-phd-de,177851,academia:good time management,keyword_query_mapping_v1,English,2026-04-27,project_team,keyword_mapping_needs_manual_review,needs_review,Scraped online text; verify label manually before final modeling.
