id,text,stress_level,source_type,source_name,source_url,source_record_id,original_label,label_mapping_rule,language,date_collected,collector,labeler,review_status,notes
scraped_00066,"Do associate editors or editors in chief get any monetary compensation, and to what extent?. I'm aware that academic editorial work is to a good extent a voluntary service to the community. Peer reviewing, to my knowledge, is always a voluntary service, for a whole number of good reasons, e.g. to remain independent and impartial, or to avoid scientific misconduct. Anyway, because of the different task profile and responsibilities of editors in chief (EiCs), associate editors, guest editors, and other academic editorial staffs, I wonder about types of journals, which pay these roles for their services? I'm aware that some less known/traditional/established publishers pay parts of their academic editorial staffs. (I am not referring to paid full-time employees of publishers, such as management staffs and members of production teams.) I also wonder how much in terms of a full-time equivalent salary that would typically be? Ranges or percentages by country, discipline, or even publisher would already shed light on this.",Low,online_scraping_api,Stack Exchange API,https://academia.stackexchange.com/questions/175673/do-associate-editors-or-editors-in-chief-get-any-monetary-compensation-and-to-w,175673,academia:good time management,keyword_query_mapping_v1,English,2026-04-27,project_team,keyword_mapping_needs_manual_review,needs_review,Scraped online text; verify label manually before final modeling.
scraped_00067,"Remote manager keeps taking it out on the same colleague. I am a young software developer working in a big french tech company. There is this toxic relationship between one of my colleague and our manager that I am really concerned about. There has been many hints of it, but today was the day that tears it. I'll try to be concise : our team was taking a break this afternoon like we are used to for about half an hour. Suddenly, my colleague received a call on her phone from our product owner. He advised her to sit back to her desk as soon as possible because our remote manager just asked him what was she doing, since her Skype indicated she was absent for a while. The problem here is that she was the only person that has been required to end her break while we were 4 out of 6 members taking it. Furthermore, he did not need anything from her : he just wanted to know why she wasn't at her desk. Does he even have the right to use Skype as a tool to survey our activity? One of the oddest part of this is that he just came back from vacation, which made me wondering why can't he find a better thing to do. I also can't figure out why our product owner has been implied in this since everyone knew that he was telecommuting. Other than that, there has been this awkward moment when we were asked to identify a set of errors that kept occurring within our application. My colleague took the responsibility for the task, and she produced a high-grade report where every single error has been handily documented. She then orally presented it to our manager, who seemed pleased about it. However, it was only in appearance because he totally ignored her work and acted like he never knew about it by asking someone else to work on the exact same task a few days later. One last example that drives me crazy the most: back in late 2018, the new version of the product we were working on had to be launched in production. Since we have a broad customer base, most of it had to be done during the night. My colleague thought of it as a nice opportunity to learn how such a large application could be deployed and thus participated to it. This point of view was not shared by everyone though : our manager then blame her to have taken advantage of the occasion to ""have her next day off"" (as required by the law) and ""maybe do some shopping"". I truly can't grasp the thought process behind this considering any reasonable human would be too tired to do anything productive the next day. But I think the worse in all this is that our manager's opinion does not reflect the reality at all . Indeed, she does an incredible amount of work and we unanimously recognize that she is one of the most invested members of our team. For example, she wouldn't hesitate bringing her computer home if she estimates that her tasks should have been done by the end of the day. Moreover, my colleague is sincerely one of the most impressive people I know : unlike me, she does not have a background in software engineering and she is just as competent as I am for any given task of the project (even a bit more, but she'll always modestly disagree). So, in what direction should I guide her to in order to get out this insane situation? I am also quite anxious since a while because she mentioned willing to resign several times. I think it would permanently affect my well-being at work if she does so. And each time we discuss about the problem I am never too sure about what advice I could give her, and simply acknowledge that her situation is unfair and perhaps discriminatory.",Medium,online_scraping_api,Stack Exchange API,https://workplace.stackexchange.com/questions/128790/remote-manager-keeps-taking-it-out-on-the-same-colleague,128790,workplace:concerned about grades,keyword_query_mapping_v1,English,2026-04-27,project_team,keyword_mapping_needs_manual_review,needs_review,Scraped online text; verify label manually before final modeling.
scraped_00068,"Former manager and team keep reaching out with questions despite transferring to a new team. I recently switched to a different team within the same company. This was a transfer that's been in the works for over 6 months and everyone was informed that I was looking for a new opportunity within the company. Once my new role was finalized, my new manager reached out to my old one to discuss a transition plan. After setting up time to hire my backfill, a 1 month handover period was agreed upon. I proceeded to set up an extensive handover including multiple onboarding sessions for the new hires, working sessions with day-to-day tasks, as well as an extensive document detailing daily responsibilities, upcoming responsibilities, contacts for internal and external teams, and all necessary links. Prior to transitioning I also made sure the team plus my manager were introduced to everyone I worked with both internally and externally and looped into all emails. It's been about a week since I transferred and I have been getting constant messages from both my previous manager and team-- nearly every single hour. These were simple questions (think: is this client a part of this parent company) that were already covered in my handover and/or was very basic information that you could figure out by googling. Everytime I redirected the team to prioritize speaking to my previous manager (and their current one) they let me know that they had approached him first and he told them to just ask me. I hate saying no to my team, especially if they're asking for support however these are basic questions which my previous manager knows how to answer. It all came to a boiling point when out of the blue he started dialing me into a call while I was already on another. I messaged him saying I did not have the flexibility to join meetings however I'd be happy to answer questions via chat or email. He said I had to join and that it was urgent concerning a client who was unhappy. For context: the client was unhappy because he had not handled an issue that I'd called out was his responsibility before transitioning. I told him that I had other responsibilities I needed to prioritize at which point he started getting much ruder via chat: he told me that he expected me to join calls when the team needed (not agreed upon prior to my handover) and that he ""could"" have made me handover for 2 months but had been nice enough to allow me to do so in 1 month. I didn't give in, however I was extremely frustrated at his behavior. My new job is extremely rigorous and I do not have time to prioritize tasks that I've already handed over. For context, this is a recurring issue with him where he doesn't handle problems until they get out of hand and expects people to clean up his mess. He never pushes back on tasks we shouldn't be handling or that have shortened timelines and for him everything is a priority. I was senior enough to handle his behavior and push back and maintain timelines, however my team is much more junior than I am and I dont know if they will feel empowered to do so. I had expected him to step in once I left, but it appears he doesn't want to. I am considering chatting with his manager (the head of the department) who I have a good relationship with, however I dont want to burden her unnecessarily and I'm not sure if this will sour my relationship with my previous team members. As much as I'd like to provide support, I dont have the bandwidth to do so and it's not fair to them to have zero management. I'd like some advice as to whether I should handle this myself (and how) or if I should start looping in other folks. At the minimum I might chat to my current manager for advice about all of this.",Low,online_scraping_api,Stack Exchange API,https://workplace.stackexchange.com/questions/198608/former-manager-and-team-keep-reaching-out-with-questions-despite-transferring-to,198608,workplace:good time management,keyword_query_mapping_v1,English,2026-04-27,project_team,keyword_mapping_needs_manual_review,needs_review,Scraped online text; verify label manually before final modeling.
scraped_00069,"Assisting an employee to disconnect from work and prevent burnout. I am a manager (indirect to this person) in a small UK based company and work with a fantastic colleague/friend who is rapidly approaching complete burnout. The job is non-physical, involves data/statistics and is conducted primarily whilst working from home. They seem unable to switch off from work, always trying to be available, assisting other employee's tasks during their own non-working hours, frequently working very unsocial and unsustainable hours (e.g: sometimes 20 hours at a time). They do considerably more than what is expected of them. I appreciate that they are an adult and their decisions are their own, but I am very concerned about their health. They book holiday but don't really take the time off, instead they are checking emails, company messaging apps and accessing parts of the system in order to provide stats and answers to other employees, or just continuing their own work. Direct management and myself have tried on many occasions to discuss with them about their working behaviour, that it isn't necessary and we don't want them putting so much of a strain on themselves, but the message doesn't seem to be getting through. How can we further assist this employee to actually disconnect from work? We've tried stocking them up with additional PTO to compensate for the additional hours of work being provided, but believe the employee just typically works through those as well. We are at the stage where we're considering suspending email/system/contact apps for the duration of their booked holiday time to forcefully prevent them from accessing work, but we wouldn't want that run foul of any potential employment laws. It may seem a be dramatic/over the top, but would that be in our rights? Any other answers, or recommendations to not do that are also welcome. edit, additional background info: Conversations with my colleague about why they are working so many hours focus around priority and a self-determined urgency. They are a manager themselves (but this sense of urgency/""now now now"" is thankfully not distributed to their team) but are always way too critical of their own work, for example they express that ""they could have done better"" or ""could have done this sooner"". This does not mirror the feedback they receive on their work, which is typically very positive. I believe they want to over-perform in all areas, even those in which they should only be involved to a minor extent. Trying to establish why they are contributing such huge efforts has been difficult, as they have admitted they don't really know where they want to go in terms of progression, or if they even necessarily want to ""progress"". I personally do not believe any level of promotion would adjust the way they work, they constantly want to produce all work to the highest standard possible, which isn't feasible. They have a very strong work ethic, which whilst typically a good thing, is contributing to their problems. In recent conversations they are self-aware of this and even agree, they just find it incredibly hard or seemingly impossible to stop.",Low,online_scraping_api,Stack Exchange API,https://workplace.stackexchange.com/questions/190144/assisting-an-employee-to-disconnect-from-work-and-prevent-burnout,190144,workplace:good time management,keyword_query_mapping_v1,English,2026-04-27,project_team,keyword_mapping_needs_manual_review,needs_review,Scraped online text; verify label manually before final modeling.
scraped_00070,"Job title doesn't match my work. My job title is something scientific like ""Biochemical Engineer"" but as a person with strong computer skills broadly, I spend most of my time (~80%) doing a mix of software development, maintaining on-premise servers, networking, database management, and similar stuff. I end up working in-between the software and science teams at the company a lot. I like the work and it pays well, but the situation feels bad professionally. My issues are: My boss is happy I'm doing this so that others don't have to, but has no idea what I'm doing 90% of the time. I feel this strains our relationship and I don't get mentorship. I feel that computer work is undervalued by the scientists in the company, putting me at long odds for promotions and career development within my current team. The computer work makes it hard to keep up with the scientific work, furthering the divide. Tech leads in the science team don't come to me for new projects or related work, leaving me to ""do my thing"", and I feel I have to put a large effort in keeping myself included. At some point the company will probably need ""real"" dev-ops and IT people, at which point I may be left out in the cold. For future jobs, I'm either lacking in the skills expected of other ""biochemical engineers"" or I will have to convince recruiters that actually I'm a good software developer or similar despite my lack of title & training. It's obvious to me that the situation overall is affecting my happiness/anxiety levels and I should find a solution. I would appreciate others perspectives on whether these concerns are reasonable or not. I feel my general options are: Leave (duh, but see 5. above). Ask for a promotion / different title or better recognition within the science team. I'm not exactly sure what title/role I could reasonably ask for. I could make up a title which would seem better and reflect the multidisplinary nature of the work but I'm not sure if management would be open to that or if it's a good idea. Ask for a transfer to the software team. The software team might be a better fit but doesn't currently have any explicit openings I'd fit in, but I'm on good terms with the software team management. I would appreciate other perspectives on my options, if I'm missing anything or if there are other things I haven't considered.",Low,online_scraping_api,Stack Exchange API,https://workplace.stackexchange.com/questions/197906/job-title-doesnt-match-my-work,197906,workplace:good time management,keyword_query_mapping_v1,English,2026-04-27,project_team,keyword_mapping_needs_manual_review,needs_review,Scraped online text; verify label manually before final modeling.
scraped_00071,"How to gently enforce ""nohello"" to a coworker?. I am a huge proponent of nohello in the workplace - I get way too many Slack messages and other interrupts to waste time on pleasantries. I keep my Slack status set to "" nohello.com "" as a way to remind my coworkers of this, and generally don't respond to Slack messages unless they contain something I can respond to. Most of my coworkers are fine with this, and many do the same. However, I have one coworker who doesn't seem to notice or care. Her messages to me always look like this: Her: Good morning! Her: How are you? Then silence until I answer her and engage in pleasantries, after which she'll finally get to the point. This can occupy several minutes or more as I answer her, go back to what I was doing while waiting for her to respond, then get interrupted again when she responds a few minutes later with another pleasantry, etc. I've tried ignoring her until she asks an actual question, but she'll just wait (possibly assuming I'm busy/afk?), meaning her question doesn't get answered. How can I politely inform her that I need her to get to the point immediately and not waste my time on pleasantries? Ignoring her means her question doesn't get answered because she won't ask it until I respond to her pleasantries, and also means I am constantly low-level aware of her hanging ping, which makes it hard to concentrate on my work. But if I don't ignore her, I waste a bunch of time engaging in meaningless ""hi, how are you, how was your weekend, what are you up to?"" back-and-forth in Slack that constantly interrupts my flow. This also encourages her to continue opening with pleasantries, further interrupting my flow later. To be clear, my issue is not with pleasantries qua pleasantries. I don't mind chatting with coworkers around the lunch room or in the halls, or in the general-chat Slack channels. The issue is that when a coworker sends only pleasantries instead of asking their question in their first message, it repeatedly breaks my focus (one interruption per pleasantry exchange, often spaced out over several minutes to hours depending on when we're each next able to respond on Slack) and delays me from answering the question. Just saying ""hey stop with the pleasantries and get to the point"" is likely to come across as rude to her. Her job is focused around people management and contractor interfacing, and I suspect some of the disconnect comes from the fact that her job normally requires her to be extra-pleasant and friendly, while mine is all about speed and getting to the point. What is a polite way to make clear to a coworker that I will not respond to empty pleasantries in Slack, and she needs to ask her question up front before I will respond?",Low,online_scraping_api,Stack Exchange API,https://workplace.stackexchange.com/questions/119137/how-to-gently-enforce-nohello-to-a-coworker,119137,workplace:good time management,keyword_query_mapping_v1,English,2026-04-27,project_team,keyword_mapping_needs_manual_review,needs_review,Scraped online text; verify label manually before final modeling.
scraped_00072,"How do I talk about money with my partner when they get uncomfortable about the topic?. The Background My partner and I have been together for a significant amount of time, 8 years soon, and are planning to get married (within a few years due to busy schedules and graduate school). I have recently gotten very much into personal finance and have started budgeting using spreadsheets and planning for expenses and such ahead of time. I have been saving my own money for a while and it makes me feel very good to know that what I'm doing now is going to kick-start a great and relaxed future of financial independence (that's the goal anyway). My partner on the other hand has been increasingly strapped for cash, as is the process for graduate school students. They have taken out many loans to pay for school and by the end of it all it will amount to somewhere in the region of $150-200k. Because of the schooling and time commitment, they are unable to work for very long during their studies (in fact, the school recommended no more than 5-10 hours a month to be spent working outside of schoolwork, due to the heavy course-load) and so can earn very little of their own money. It is because of this that I want to press forward with my idea of being fiscally responsible and keeping track of things, so that we can dig ourselves out of the hole of (necessary and understandable) debt that will inevitably be created by these life decisions. The Problem As a result of all of these factors, I have been solely financially responsible for the both of us (rent, food, bills, etc.) I have absolutely no problem with this, but it seems that my partner feels awful about it. They take it very hard when something happens that costs money could be spun as their fault. As an example, some dishes fall off of the counter and shatter on the floor meaning they need to be replaced. This is taken by my partner as a great mistake and ""now the budget is going to be off and its all my fault, I'll pay you back for this, I promise."" I would rather not focus on these events, as ultimately a little hiccup in the budget doesn't really matter in the grand scheme of things IMO I want to be able to convince my partner that its not an issue for us to spend money on things; just because we don't have much money, doesn't mean we don't have any and that we are going to starve for needing to spend an extra $20-50 here and there. My partner and I both grew up in lower-middle class families, however due to me being an only child and them being in a family of 5, money was always more of a touchy subject in their life than in mine. I worry that the stress that I am causing as a result of my insistence of tracking our expenditures (not to a crazy extent, but to one that allows for it to be effective) is becoming too much for my partner to handle. I want to discuss these things and make sure that we are on the same page about finances since coming up soon, it is going to be not just my finances and my partner's finances, but rather our finances. I know the common advice of ""it's their money and you can't tell them how to spend it,"" but in this case it's my money, and I want to be sure that it is US that benefits in the long run, without overstepping comfort zones. I heard somewhere that the most common reason cited in divorce is financial issues. Obviously, this is something that I would like to avoid, and I'd like to be started in conversation and communication sooner rather than later. Recently, I have been looking to meet with a financial advisor to make sure that we are on the right track. I want my partner to attend these meetings with me, even if right now the only funds will be ""my funds."" Unfortunately I am having a very difficult time coming up with a way to ask them if they would like to attend these meetings with me, that would avoid adding unneeded stress onto my partner's platter. (Indeed a quite full platter) The Questions How should I go about asking my partner about planning our financial future, when I know that they are already stressed, and will likely become more stressed after I ask? What can I do that might help them understand that I am fine with supporting the both of us in this journey, and that they don't owe me anything, since we will both benefit in the long run? [Update]: We have gone to a meeting with the financial advisor as mentioned above, but it seems like the situation is still the same. My partner seemed uncomfortable during the meeting; when pressed, they replied that they were simply bored, since none of it really applied to them. ""It's not my money, after all."" Relating to my second question: how can I convince them that it really is our money? Or will that just need to wait until I have our marriage to lean on for ""proof""?",Low,online_scraping_api,Stack Exchange API,https://interpersonal.stackexchange.com/questions/27380/how-do-i-talk-about-money-with-my-partner-when-they-get-uncomfortable-about-the,27380,interpersonal:relaxed study schedule,keyword_query_mapping_v1,English,2026-04-27,project_team,keyword_mapping_needs_manual_review,needs_review,Scraped online text; verify label manually before final modeling.
