id,text,stress_level,source_type,source_name,source_url,source_record_id,original_label,label_mapping_rule,language,date_collected,collector,labeler,review_status,notes
scraped_00001,"Is it okay to publish my thesis when it was done 2 yrs ago?. Is it okay to publish my thesis when it was done 2 yrs ago? I defended my master's thesis in February 2016 but the data gathering was done in October 2015 and the final revision was submitted to my university in March 2016. I thought of submitting my thesis for journal publication. Do you think they would still accept it when it's been done 2 yrs ago? I had been very busy after graduation and I never had the chance to submit my research paper for publication. Hope for your enlightenment Follow-up: Thank you for taking time in answering my query. My field of study is in Psychology. It's a causal, experimental research. After I defended my thesis, I got the highest grade in my final defense. I was told by my adviser to submit my paper for journal publication and present it on the upcoming convention (that year) but I had been extremely busy because I focused on the licensure exam that time. It's not totally an original study because I adopted the intervention from the US. My study was to try it in the Philippine setting but there were some modification on the approach to suit with the respondents. I'm concerned about the originality, if you send your paper for publication, does it really have to be fully original especially the intervention? I really want to have it published so I can teach this intervention to others (to my community) especially to financially incapable families who can't afford to pay for a behavioral therapist or psychologist. Since the intervention is a cost-effective approach.",Medium,online_scraping_api,Stack Exchange API,https://academia.stackexchange.com/questions/107623/is-it-okay-to-publish-my-thesis-when-it-was-done-2-yrs-ago,107623,academia:concerned about grades,keyword_query_mapping_v1,English,2026-04-27,project_team,keyword_mapping_needs_manual_review,needs_review,Scraped online text; verify label manually before final modeling.
scraped_00002,"Avoiding conferences: Potential effects on an academic career and mitigation strategies. The following question is triggered by reading this recent question as well as by a recent case of an organizing committee member approaching me with invitation to present at a well-known (at least, within my discipline of information systems and a larger management sciences field) conference . Unfortunately, I had to politely decline his kind invitation and an exciting opportunity for academic research career building and networking, especially considering that I am a beginning researcher. The reason for why I had to decline that promising invitation is twofold: 1) at this time, I'm a non-affiliated (independent) researcher with no financial support for research activities, including attending conferences - needless to say that I simply cannot afford to attend them on my own (but, even, if I would be, say, a postdoctoral researcher with some research budget, as far as I know, funds for attending conferences or similar events are quite limited); 2) my current life circumstances are not too favorable in terms of traveling (though, it is possible); moreover, I tend to agree with the ""time lost"" point, mentioned in this nice answer (though, I realize that it is a matter of assessing and balancing between time and effort spent on preparation for presenting at a conference and a potential academic and career value of a prospective event). Considering all the above-mentioned points and circumstances, my questions are as follows: Is it possible to build a good research academic career, avoiding publishing for (and, thus, presenting at) conferences and, instead, focusing at disseminating research artifacts via journal publications (in addition to working papers, industry articles, workshops, etc.)? To what extent, if any, it would be damaging to a researcher, especially in early career, to use the strategy above and what are some potential mitigation strategic and tactical measures other than attending (and presenting at) conferences? Note: My questions above imply conferences only, as workshops or similar smaller events seem to be more affordable and, sometimes, even, free to attend and/or to present at.",Low,online_scraping_api,Stack Exchange API,https://academia.stackexchange.com/questions/49438/avoiding-conferences-potential-effects-on-an-academic-career-and-mitigation-str,49438,academia:good time management,keyword_query_mapping_v1,English,2026-04-27,project_team,keyword_mapping_needs_manual_review,needs_review,Scraped online text; verify label manually before final modeling.
scraped_00003,"Should I have said anything to my team member with the feedback I got at work sponsored social event?. I am a manager within the cybersecurity division where I work. I am in the United States and this event occurs in the USA. I have a team of 10 people. Recently, I was at a my company's regional headquarters attending a divisional event sponsored by senior management. The itinerary included a team social event after formal work hours (9 - 5 EST) that is open to all attending with the aim to socialize with colleagues outside one's immediate team. A cash bar was onsite where folks can order drinks. 1 free drink was offered to all attendees and one can purchase more drinks afterwards, with no strict enforced limit (i.e: outside of social norms and professionalism). I had a few drinks and was really enjoying myself, socially talking with colleagues, singing karaoke, and playing board games alongside trivia. The same applied to my team members. I was surprised that other divisional ( non team) and non - management level employees said one of my team members , while not behaving inappropriately or being overtly intoxicated, was showing the below: More talkative and talking more loudly than usual Animated emotions and more frequent laughter Much more open with sharing of personal life Disinhibted singing Karaoke and taking pictures with colleagues At time of comment, I was buzzed and the folks who gave me the feedback also had been drinking. I saw the feedback as an indication that folks were having a good time, and not as a complaint of unprofessional conduct , deserving reprimand. Question Should I have said anything to my team member the day after? Should I own my team members behavior as their direct manager? What , if anything, should I have said to the divisional employees who provided me with the above information on my team member?",Low,online_scraping_api,Stack Exchange API,https://workplace.stackexchange.com/questions/198713/should-i-have-said-anything-to-my-team-member-with-the-feedback-i-got-at-work-sp,198713,workplace:good time management,keyword_query_mapping_v1,English,2026-04-27,project_team,keyword_mapping_needs_manual_review,needs_review,Scraped online text; verify label manually before final modeling.
scraped_00004,"How to deal with a manager who deliberately overloads you with work. I work at an in-house creative agency as a UX/UI Designer. My line manger is the creative director, I am the only person in the team other than him who does UX UI work. It seems to me he believes that everyone should ALWAYS be working and working outside of work hours as well. However, he is careful to never suggest this out loud or in writing. I track all my work and give weekly reports, usually when he sends new work I tell hime I am working on X and won’t have time to do Y. His response is typically “oh, you should be able to do that in 15 min” To which I usually respond by explaining the true complexity of the task, how long similar tasks have taken in the past and the tradeoffs relative to the other work I am doing making it clear that I don’t have enough time. His typical follow up is just do the most you can But also work on the other projects. Let me share some examples: Example 1: If I come close to 9 o’clock and if while turning on my computer, I begin chatting with a colleague for a few min. He’ll notice, email me some work and say “hay could you look at xyz, this is urgent just came in” (even though its one of his tasks or has been sitting in the task inbox unassigned for a while and I have plenty of stuff to do already. Example 2: He always sets team meeting to 9am on a Monday or Friday to get people to come in early, even though he himself rarely joins and if he does so its typically towards the end. Example 3: After tracking my time for months and developing a reasonable model of how long a task typically takes, and present this to him infant of this manager he agreed to take some work off me. But first of all he took the most high-profile work that requires face-time with the CEO, of the three tasks he took on he failed to do any work on 2 of them, took a sick day, called me and asked me to look at the two projects, after he came back the next day and I tried to hand them back he said I was doing a great job already. Example 4: We track time to bill to clients using an internal system. He regularly drops hints at me to overestimate the amount of work I’ve done for clients e.g. the other week I noted you did this over the weekend make sure you track that. Or I noticed you came in 2hrs early to get this done make sure you track that. Or my favourite: “Make sure you quote for the value provided not the time spent” I have tried everything I could think of: tracking time, emailing him my daily activity and priorities and informing him of every trade off. Raising the workload issue with his manager. After his manager forced him to look at workloads he ask the team to come up with a number of projects they each think they can work on simultaneously which was 4 or 5, with 3x with clients for feedback and 2x active. But he told me to that this doesn’t apply to my work and that we ought to catchup later. I hate playing an armchair psychologist but by my estimation he has ADHD, he only works on projects last minute, is terrible at estimating how long something will take, constantly over promises to clients, and routinely avoids doing work by coming in late, having very long lunches, and then doing work last minute outside of working hours. When I suggested that we ought to get a project manager and work in an agile fashion like the developers he refused. Later I over-heard him say to his manager: “there is good things about agile, but I don’t think its right for UX work”. If I work closely with developers it makes sense for me to use their methodology as I have to attend stand-ups anyway. Sorry for the long post but I just wanted to illustrate how he consistently tries to make sure that everyone is always working on 110% capacity such that they are forced to stay late or work weekend. The rest of the company outside of his direct reports follows an agile methodology, people don’t setup meetings for 9 o’clock and estimate time in afternoons to account for switching costs, and even a little office banter, which in my option is completely acceptable. I have started applying for jobs and going for interviews, but since I have a 3-month notice period I am still stuck here for three months, what do I do ? P.S. I also think my co-workers who are managed by him are showing signs of stress one has difficulty sleeping, another keeps chewing their nails and spoke about how she has started seeing a therapist, and a third is concerned she might have heart issues because she has palpitations.",Medium,online_scraping_api,Stack Exchange API,https://workplace.stackexchange.com/questions/149896/how-to-deal-with-a-manager-who-deliberately-overloads-you-with-work,149896,workplace:stress workload manage,keyword_query_mapping_v1,English,2026-04-27,project_team,keyword_mapping_needs_manual_review,needs_review,Scraped online text; verify label manually before final modeling.
scraped_00005,"Why do many talented scientists write horrible software?. I am a software engineer and I have been working with people with academic backgrounds for several years. Many times, I've noticed that (even otherwise brilliant scientists) produce code of extremely low quality (unless their background was precisely Computer Science). Since those people are very good in doing their research - and eventually obtain remarkable results - it seems they are clever enough to write decent code. Is it just that they don't think it's worth the effort? Plain arrogance? Lack of time? Examples It seems to me that in academia the most popular languages are C/C++ and Python (neglecting MATLAB and other vendor-specific languages). The language where I have seen the most amazing pieces of junk is actually C++. The main points are: Really, really naive C++ code. They claim they chose C++ over Java/Python/whatever because ""it's faster"", but they new everything, even an array of 3 float s that is deallocated few lines later, where 3 is known at compile time. They have learned pointers from C and they use only them. Some of them (not most of them) have read some random blog posts about OOP and now put virtual everywhere, using abnormal levels of abstraction. They are convinced of pointless optimization choices. They lack proper memory management. They copy/paste massive amounts of code from project to project and within the same project as well. And in this list I am omitting the problems with the process , rather than the product. Scientists use: no version control, no automated builds, no documentation, no software process at all (neither agile , nor traditional waterfall ). The workflow is: I devise the algorithm, I write it as a massive 10k LOC piece of C++ and I click build somewhere. As this assessment could be probably biased by my own experience, I have inspected some open source projects run by researchers (and maybe a few software engineers) and cited in many important papers. Virtually all of them were: crashing on corner cases, had ugly GUIs, and the code - in my opinion - was ready for a complete rewrite.",Low,online_scraping_api,Stack Exchange API,https://academia.stackexchange.com/questions/17781/why-do-many-talented-scientists-write-horrible-software,17781,academia:good time management,keyword_query_mapping_v1,English,2026-04-27,project_team,keyword_mapping_needs_manual_review,needs_review,Scraped online text; verify label manually before final modeling.
scraped_00006,"Is stress expected this soon in my career?. I am a junior developer in a very small company and have been there for a year. Only a month ago it was just my boss and I working on developments. While I am a junior and only 21, I have had previous development and teaching experience and as such feel that I am competent in the job and do not require the hands-on teaching that most juniors need. With this in mind, I have been struggling recently to handle the stress of my job. We have extreme deadlines, very needy clients and on top of this a new junior to train, which has been allocated as my responsibility. It's not that I can't handle the work, more that there isn't enough time to handle all of this, meaning the quality of my work isn't as high as I'd perhaps like. In my role, I have often stressed personally about the performance of the team and whether these tasks will get done. I've worked late in office, and at home without being asked, haven't taken a days holiday since I started over a year ago, and frankly feel a bit like this might not be for me. My question: Should I as a junior developer be stressing out about aspects of my company that I am not directly responsible for, and what would be the correct way to proceed in this role in a way that mitigates stress?",High,online_scraping_api,Stack Exchange API,https://workplace.stackexchange.com/questions/49097/is-stress-expected-this-soon-in-my-career,49097,workplace:extreme stress deadline,keyword_query_mapping_v1,English,2026-04-27,project_team,keyword_mapping_needs_manual_review,needs_review,Scraped online text; verify label manually before final modeling.
scraped_00007,"How can an individual stop the university's standards and quality from deteriorating?. The business school I am currently at faces a very difficult situation. After a scandal involving fraud around the president a few years ago, in combination probably with fallout from the financial crisis and all, our public image is ruined. We have barely enough students applying to the open undergraduate seats, meaning that almost no selection process can take place. As a consequence, students are walking the campus that barely made it through high school and are, by any standards, not fit for academic career, not even undergrad studies. As a research assistant, I assisted my chair during the previous and current year with a first-year course, aiming to teach foundations of investments, Markovitz framework, CAPM and APT, and the like. Without going into too much detail here, I can say that this course is not a university level course. The exams are advertised to the students as consisting only of questions they know from tutorials with different numbers or asking for a different variable. No out-of-the-box thinking, no mathematical proof or derivation of one of the financial concepts. This alone would lead to no necessary problems, and perhaps my own perspective is distorted, as I did my undergrad studies in natural science, but there are additional problems. Every year, less and less students are coming to the professor's lectures. The tutorials from my colleague and me are visited by 2-7 students out of 35. During longer explanations or examples, they often interrupt without respect and ask ""is this relevant for the exam?"" Students still perform horribly on the exam, but we cater them by adding an offset, based on at most 15% of the students failing the exam (in reality, around 70% fail the first round). With another incredibly generous offset such that no more than 20% of those in the second exam round fail, there is virtually no selection any more, which is horrible, because we are a small private institution and once were one of few leading business schools in the region, which is no longer the case. My explanation, which I have presented to my boss, is that the students hear from the previous year's students about the generous offset, and that the university does not want to throw out that many students. Based on this rumor, they study less, so that we are forced to give the offset they expect. Why are we forced? Because the professor admits that he will not be able to explain to the university management if they inquire as to why that many students fail. He claims that many colleagues are wondering where many of our students came from, because it certainly does not seem to be high school, and that only the management, which consists of business types, not academics, know the answer. Probably, we are dependent on the cash flow from the students' tuition fees, but this is a short-term solution at an invaluable long-term cost. I would believe that a rigorous filtering process should be in place, and rather in the second semester than in the fourth or six semester. But compared to other chairs, we already have a rough reputation, and most of the undergrad program consists of electives in fields like marketing, where I have supervised some exams and had to observe that those exams consist almost entirely of reciting definitions and giving examples that were completely mentioned in the learning materials the students had access to. This is absolutely not worthy of a university, but a degree mill instead. We are now treating students more and more like customers; many of our best colleagues in the examination office have left us during the past year; officially for personal reasons, but I believe that students claiming ""I pay a lot of money, I can demand a good grade"" might also be a factor. Nobody wants to fail the students, but instead hopes that other courses will do this uncomfortable job; and my boss and me are often giving grades in the range 3.5-4 for Bachelor Theses, because ""even if they pass, they will not have a good career anyway"". Another professor in the department replied to this with: ""Well, I would not worry, because the employers will realize quickly the quality of these graduates, and put them into some fixed-income positions or similar where they cannot do any damage."" However, I already heard first-hand from professionals that there are complete firms out there that do not even invite our students for interviews any more. Since I am not only doing my PhD here, but also have a Master's degree from this place, you can imagine this gives me a funny feeling. The off-campus behavior and image of our student body in the local community is disastrous. One and a half weeks ago, a student drove drunk and crashed into a fence in the neighboring village (the fact that we are not in a large city does not help). Everyone in the village knows that it was a student (the car is a quite ""unique"" one), and there was a newspaper article indicating the BAC of the driver. But since there is no official affiliation between the accident and the university, and the newspaper did not mention that the driver was a student, there is nothing that can be done, as my boss, who is also in the judicial board, says. My boss also says that he is involved more and more often in heavier and heavier cases of students that break rules of common sense, morals and even criminal law worldwide during their exchange semesters. Last week, I had an internship report on my desk, which is really not a piece of work a student should fail. But it should have; the text was full of language mistakes, typos, even spelling (not typing) the place in his address wrong, formatting was bad, and when describing the $\beta$ in CAPM as ""the relative volatility of the asset compared to the market"", the paper screamed at me ""I don't care about this and have no respect for higher education"" at such a volume that I gave a failing grade. (This was the second try; the first one was failed deliberately in summer, as the student claimed not to have enough time to work on it anyway.) Then, after the student calling me frantically and the examination office and the program director contacting me, I gave a passing grade, because I had to admit that some parts of the work were presented, in their unprecedented shallowness, ""plausibly"", hence ticking off the ""plausible presentation"" checkbox on the examination sheet and finding good sub-grades for a work that, in its entirety, was not worthy of a sixth semester students. During this process, I was kindly reminded from my boss to ""keep in mind that you are ruining his entire career, as he will be ex-matriculated and barred from studying business studies again"" - a little too much to not be influenced, I would say in hindsight. I ended by inviting the student into my office, rubbing every single error in the file into his face, demanding an explanation for the horrendous work, and telling him that only the static examination sheet saved him, while any employer would have fired him on the spot. The reaction was not understanding at all, and as my colleague pointed out, did not even once say thanks for me taking the extra time to go through the work again, after the failing grade was practically set. And now, having let the work pass, I think I have become part of the problem. What should I do? How can I prevent myself (and others) from doing what I did, and falling into this abyss?",Low,online_scraping_api,Stack Exchange API,https://academia.stackexchange.com/questions/62692/how-can-an-individual-stop-the-universitys-standards-and-quality-from-deteriora,62692,academia:good time management,keyword_query_mapping_v1,English,2026-04-27,project_team,keyword_mapping_needs_manual_review,needs_review,Scraped online text; verify label manually before final modeling.
